tweet_id,text,rating_numerator,rating_denominator,name,type,p1,p1_conf,p2,p2_conf,p3,p3_conf,retweet_count,favorite_count,created_at
680940246314430465,This is Alice. She's an idiot. 4/10 https://t.co/VQXdwJfkyS,13.215172413793104,10.0,Alice,,soft-coated_wheaten_terrier,0.289598,West_Highland_white_terrier,0.157195,toy_poodle,0.0744346999999999,922,2865,2015-12-27 02:36:20
680934982542561280,Say hello to Sadie. She's a Tortellini Sidewinder. Very jubilant pup. Seems loyal. Leaves on point. 10/10 petable af https://t.co/g2bTu4ayPl,10.0,10.0,Sadie,,Labrador_retriever,0.7843979999999999,Siberian_husky,0.0559251,beagle,0.0227501,389,1875,2015-12-27 02:15:25
680913438424612864,Meet Griswold. He's dapper as hell. Already pumped for next Christmas. 11/10 https://t.co/5NrpNDyFzN,11.0,10.0,Griswold,,Pomeranian,0.615678,golden_retriever,0.1264549999999999,Chihuahua,0.0871836,555,2166,2015-12-27 00:49:49
680889648562991104,This is Cheesy. It's her birthday. She's patiently waiting to eat her party muffin. 9/10 happy birthday pup https://t.co/cH2H7mch2H,9.0,10.0,Cheesy,,Shetland_sheepdog,0.876337,collie,0.078331,Pomeranian,0.0204075,317,1569,2015-12-26 23:15:17
680836378243002368,This is Ellie. She's secretly ferocious. 12/10 very deadly pupper https://t.co/BF4BW8LUgb,12.0,10.0,Ellie,pupper,Pembroke,0.427781,Shetland_sheepdog,0.160669,Pomeranian,0.11125,1168,3122,2015-12-26 19:43:36
680801747103793152,Great picture here. Dog on the right panicked &amp; forgot about his tongue. Middle green dog must've fainted. All 10/10 https://t.co/31npKUAox0,10.0,10.0,,,pug,0.99672,Labrador_retriever,0.00143879,Staffordshire_bullterrier,0.000517603,734,2145,2015-12-26 17:25:59
680609293079592961,This is Brody. That is his chair. He loves his chair. Never leaves it. 9/10 might be stuck actually https://t.co/WvJRg0XJit,9.0,10.0,Brody,,French_bulldog,0.700764,Chihuahua,0.0723896,American_Staffordshire_terrier,0.0396186999999999,621,2361,2015-12-26 04:41:15
680494726643068929,Here we have uncovered an entire battalion of holiday puppers. Average of 11.26/10 https://t.co/eNm2S6p9BD,13.215172413793104,10.0,,,kuvasz,0.438627,Samoyed,0.111622,Great_Pyrenees,0.0640608,429,1540,2015-12-25 21:06:00
680473011644985345,"This is Hector. He thinks he's a hammer. Silly Hector. You're a pupper, not a hammer. 10/10 https://t.co/OdUFuZIXiI",10.0,10.0,Hector,pupper,Lakeland_terrier,0.796694,West_Highland_white_terrier,0.138709,Norwich_terrier,0.0162533999999999,656,2304,2015-12-25 19:39:43
680191257256136705,Here's a sleepy Christmas pupper 11/10 https://t.co/KXg0f8GNQ9,11.0,10.0,,pupper,Brittany_spaniel,0.7332529999999999,Welsh_springer_spaniel,0.251634,English_springer,0.00924321,437,1939,2015-12-25 01:00:07
680161097740095489,Meet Goliath. He's an example of irony. Head is phenomenally round. Wants to be an ornament. 12/10 would hug gently https://t.co/72Dil0Aktw,12.0,10.0,Goliath,,bluetick,0.268681,miniature_pinscher,0.1256519999999999,English_setter,0.0893727,655,2097,2015-12-24 23:00:17
680145970311643136,Say hello to Kawhi. He was doing fine until his hat fell off. He got it back though. 10/10 deep breaths pupper https://t.co/N5pM6WBx7e,10.0,10.0,Kawhi,pupper,miniature_poodle,0.457117,toy_poodle,0.226481,Maltese_dog,0.0676815,1537,3244,2015-12-24 22:00:10
680130881361686529,This is Reggie. His Santa hat is a little big. 10/10 he's still having fun https://t.co/w0dcGXq7qK,10.0,10.0,Reggie,,Maltese_dog,0.199121,West_Highland_white_terrier,0.197897,Shih-Tzu,0.15713,842,2070,2015-12-24 21:00:12
680115823365742593,This is Ozzy. He woke up 2 minutes before he had to be ready for the Christmas party. 9/10 classic Ozzy https://t.co/Kt9vmw0Fap,9.0,10.0,Ozzy,,pug,0.999365,French_bulldog,0.000543615,Boston_bull,2.8152800000000003e-05,812,2454,2015-12-24 20:00:22
680100725817409536,This pupper is not coming inside until she catches a snowflake on her tongue. 11/10 the determination is palpable https://t.co/lvMYbmKq8H,11.0,10.0,,pupper,golden_retriever,0.6989609999999999,chow,0.145971,Pomeranian,0.034888,1229,3242,2015-12-24 19:00:23
679862121895714818,"""Dammit hooman I'm jus trynna lik the fler"" 11/10 https://t.co/eRZRI8OTj7",11.0,10.0,,,EntleBucher,0.5232060000000001,Greater_Swiss_Mountain_dog,0.4316569999999999,Appenzeller,0.0442079,544,2193,2015-12-24 03:12:15
679844490799091713,This is Willie. He's floating away and needs your assistance. Please someone help Willie. 10/10 https://t.co/MJqygWqt8X,10.0,10.0,Willie,,Airedale,0.903832,Border_terrier,0.0347125999999999,toy_poodle,0.021378,678,2142,2015-12-24 02:02:12
679828447187857408,Everybody look at this beautiful pupper 13/10 https://t.co/hyAC5Hq9GC,13.0,10.0,,pupper,Chihuahua,0.346545,dalmatian,0.166246,toy_terrier,0.117502,12374,32496,2015-12-24 00:58:27
679777920601223168,This is Rinna. She's melting. 10/10 get inside pupper https://t.co/PA0czwucsb,10.0,10.0,Rinna,pupper,bloodhound,0.5288189999999999,bull_mastiff,0.4201189999999999,French_bulldog,0.00948059,977,2800,2015-12-23 21:37:40
679736210798047232,This pup's name is Sabertooth (parents must be cool). Ears for days. Jumps unannounced. 9/10 would pet diligently https://t.co/iazoiNUviP,9.0,10.0,,,French_bulldog,0.319139,Chihuahua,0.154088,Cardigan,0.117688,708,1873,2015-12-23 18:51:56
679722016581222400,This is Mike. He is a Jordanian Frito Pilates. Frowning because he can't see directly in front of him. 8/10 https://t.co/NL5QJwdEpF,8.0,10.0,Mike,,boxer,0.459604,Boston_bull,0.197913,French_bulldog,0.0870225,421,1506,2015-12-23 17:55:32
679475951516934144,This is Evy. She doesn't want to be a Koala. 9/10 https://t.co/VITeF0Kl9L,9.0,10.0,Evy,,Maltese_dog,0.145742,toy_poodle,0.139407,West_Highland_white_terrier,0.108821,570,1879,2015-12-23 01:37:45
679462823135686656,Meet Hurley. He's the curly one. He hugs every other dog he sees during his walk. 11/10 for spreading the love https://t.co/M6vqkt2GKV,11.0,10.0,Hurley,,toy_poodle,0.62178,miniature_poodle,0.197819,soft-coated_wheaten_terrier,0.046745,16761,28850,2015-12-23 00:45:35
679158373988876288,This is Rubio. He has too much skin. 11/10 https://t.co/NLOHmlENag,11.0,10.0,Rubio,,pug,0.272205,bull_mastiff,0.25153,bath_towel,0.116806,7130,19053,2015-12-22 04:35:49
679132435750195208,This is Louis. He's a river dancer. His friends think it's badass. All are very supportive. 10/10 for Louis https://t.co/qoIvjKMY58,10.0,10.0,Louis,,Scottish_deerhound,0.1946099999999999,Irish_wolfhound,0.162855,giant_schnauzer,0.1598369999999999,1019,2636,2015-12-22 02:52:45
679111216690831360,This is officially the greatest yawn of all time. 12/10 https://t.co/4R0Cc0sLVE,12.0,10.0,officially,,kelpie,0.189423,beagle,0.121988,basset,0.121171,2268,5311,2015-12-22 01:28:25
678991772295516161,If your Monday isn't going so well just take a look at this. Both 12/10 https://t.co/GJT6SILPGU,12.0,10.0,,,Eskimo_dog,0.330216,Siberian_husky,0.187003,Chihuahua,0.10142,1000,2022,2015-12-21 17:33:48
678969228704284672,Meet Lola. She's a Metamorphic Chartreuse. Plays with her food. Insubordinate and churlish. Exquisite hardwood 11/10 https://t.co/etpBNXwN7f,11.0,10.0,Lola,,Labrador_retriever,0.680251,Chesapeake_Bay_retriever,0.201697,golden_retriever,0.0196759,405,1469,2015-12-21 16:04:13
678800283649069056,Here's a pupper with some mean tan lines. Snazzy sweater though 12/10 https://t.co/DpCSVsl6vu,12.0,10.0,,pupper,Labrador_retriever,0.213673,beagle,0.146235,Airedale,0.122701,805,2305,2015-12-21 04:52:53
678798276842360832,This is Linda. She fucking hates trees. 7/10 https://t.co/blaY85FIxR,7.0,10.0,Linda,,Airedale,0.583122,silky_terrier,0.129567,Lakeland_terrier,0.0947266,1012,3109,2015-12-21 04:44:55
678774928607469569,This is Tug. He's not required to wear the cone he just wants his voice to project more clearly. 11/10 https://t.co/Sp739Ou2qx,11.0,10.0,Tug,,Pembroke,0.194681,toy_poodle,0.121821,Pomeranian,0.096843,804,2519,2015-12-21 03:12:08
678764513869611008,"Meet Wilson. He got caught humping the futon. He's like ""dude, help me out here"" 10/10 I'd help Wilson out https://t.co/m6XoclB0qv",10.0,10.0,Wilson,,Irish_terrier,0.696646,Australian_terrier,0.0749616,Irish_setter,0.0639011999999999,412,1457,2015-12-21 02:30:45
678755239630127104,This is Dash. He didn't think the water would be that cold. Damn it Dash it's December. Think a little. 10/10 https://t.co/NqcOwG8pxW,10.0,10.0,Dash,,malamute,0.606654,Border_collie,0.193831,collie,0.0483781,2888,6384,2015-12-21 01:53:54
678643457146150913,Meet Grizz. He just arrived. Couldn't wait until Christmas. Worried bc he saw the swastikas on the carpet. 10/10 https://t.co/QBGwYrT7rv,10.0,10.0,Grizz,,Labrador_retriever,0.338757,flat-coated_retriever,0.3044699999999999,chest,0.0933923,354,1832,2015-12-20 18:29:43
678446151570427904,Touching scene here. Really stirs up the emotions. The bond between father &amp; son. So beautiful. 10/10 for both pups https://t.co/AJWJHov5gx,10.0,10.0,,,Staffordshire_bullterrier,0.284492,Rottweiler,0.189434,American_Staffordshire_terrier,0.18943,1351,3590,2015-12-20 05:25:42
678424312106393600,This is Crystal. She's a shitty fireman. No sense of urgency. People could be dying Crystal. 2/10 just irresponsible https://t.co/rtMtjSl9pz,13.215172413793104,10.0,Crystal,,Maltese_dog,0.759945,toy_poodle,0.101194,Shih-Tzu,0.0560374,2235,4899,2015-12-20 03:58:55
678410210315247616,Say hello to Jerome. He can shoot french fries out of his mouth at insane speeds. Deadly af. 10/10 https://t.co/dIy88HwrX8,10.0,10.0,Jerome,,schipperke,0.145877,Labrador_retriever,0.0983538,kelpie,0.0973933999999999,1590,3751,2015-12-20 03:02:53
678396796259975168,These little fellas have opposite facial expressions. Both 12/10 https://t.co/LmThv0GWen,12.0,10.0,,,Pembroke,0.95618,Cardigan,0.0318031,Chihuahua,0.0062765,369,1425,2015-12-20 02:09:34
678389028614488064,"This is Bella. She just learned that her final grade in chem was a 92.49 
poor pupper 11/10 https://t.co/auOoKuoveM",11.0,10.0,Bella,pupper,miniature_pinscher,0.516284,kelpie,0.227402,vizsla,0.103246,372,1675,2015-12-20 01:38:42
678341075375947776,This pupper likes tape. 12/10 https://t.co/cSp6w5GWgm,12.0,10.0,,pupper,golden_retriever,0.853284,cocker_spaniel,0.0262298,Labrador_retriever,0.0241227999999999,468,1541,2015-12-19 22:28:09
678334497360859136,This is Rosie. She has a snazzy bow tie and a fin for a tail. Probably super fast underwater. Cool socks 10/10 https://t.co/GO76MdGBs0,10.0,10.0,Rosie,,Norfolk_terrier,0.378643,golden_retriever,0.0955939,kelpie,0.0853092,222,1159,2015-12-19 22:02:01
678278586130948096,Another spooky pupper here. Most definitely floating. No legs. Probably knows some dark magic. 10/10 very spooked https://t.co/JK8MByRzgj,10.0,10.0,,pupper,Maltese_dog,0.897841,Lhasa,0.0357175,Tibetan_terrier,0.0171074999999999,5425,10223,2015-12-19 18:19:51
678255464182861824,This is Jessifer. She is a Bismoth Teriyaki. Flowers being attacked by hurricanes on bandana (rad). 9/10 stellar pup https://t.co/nZhmRwZzWv,9.0,10.0,Jessifer,,Chihuahua,0.613819,Yorkshire_terrier,0.127931,Pomeranian,0.0621243,324,1425,2015-12-19 16:47:58
678021115718029313,This is Reese. He likes holding hands. 12/10 https://t.co/cbLroGCbmh,12.0,10.0,Reese,,miniature_pinscher,0.822048,Doberman,0.0960845,Rottweiler,0.0327093,5535,12104,2015-12-19 01:16:45
677918531514703872,"""Everything looks pretty good in there. Make sure to brush your gums. Been flossing? How's school going?"" Both 10/10 https://t.co/lWL2IMJqLR",10.0,10.0,,,Eskimo_dog,0.199347,dalmatian,0.153225,American_Staffordshire_terrier,0.107798,355,1191,2015-12-18 18:29:07
677895101218201600,Guys this was terrifying. Really spooked me up. We don't rate ghosts. We rate dogs. Please only send dogs... 9/10 https://t.co/EJImi1udYb,9.0,10.0,,,dalmatian,0.550702,kuvasz,0.0602264,Great_Pyrenees,0.0586309999999999,1808,4301,2015-12-18 16:56:01
677698403548192770,This is Sadie. She got her holidays confused. 9/10 damn it Sadie https://t.co/fm7HxOsuPK,9.0,10.0,Sadie,,Shih-Tzu,0.916645,Lhasa,0.0578834,Pekinese,0.0201258,282,1091,2015-12-18 03:54:25
677644091929329666,This is a dog swinging. I really enjoyed it so I hope you all do as well. 11/10 https://t.co/Ozo9KHTRND,11.0,10.0,a,,Chihuahua,0.626236,Italian_greyhound,0.1284829999999999,swing,0.0598404,718,1669,2015-12-18 00:18:36
677565715327688705,Contortionist pup here. Inside pentagram. Clearly worships Satan. Known to slowly push fragile stuff off tables 6/10 https://t.co/EX9oR55VMe,13.215172413793104,10.0,,,basset,0.397295,Welsh_springer_spaniel,0.199554,purse,0.105641,405,1163,2015-12-17 19:07:09
677547928504967168,Not much to say here. I just think everyone needs to see this. 12/10 https://t.co/AGag0hFHpe,12.0,10.0,,,American_Staffordshire_terrier,0.914978,Staffordshire_bullterrier,0.0843952999999999,boxer,0.000461663,3238,6191,2015-12-17 17:56:29
677530072887205888,Say hello to Axel. He's a Black Chevy Pinot on wheels. 0 to 60 in 5.7 seconds (if downhill). 9/10 I call shotgun https://t.co/DKe9DBnnHE,9.0,10.0,Axel,,Staffordshire_bullterrier,0.6892590000000001,Norwegian_elkhound,0.026121,American_Staffordshire_terrier,0.0230747,198,943,2015-12-17 16:45:31
677334615166730240,This dog gave up mid jump. 9/10 https://t.co/KmMv3Y2zI8,9.0,10.0,,,Lakeland_terrier,0.859392,Airedale,0.0672917,Irish_water_spaniel,0.0495306,248,1199,2015-12-17 03:48:51
677331501395156992,Meet Humphrey. He's a Northern Polyp Viagra. One ear works. Face stuck like that. Always surprised. 9/10 petable af https://t.co/FS7eJQM2F4,9.0,10.0,Humphrey,,beagle,0.3134639999999999,boxer,0.218503,French_bulldog,0.1064619999999999,204,968,2015-12-17 03:36:28
677314812125323265,"Meet Tassy &amp; Bee. Tassy is pretty chill, but Bee is convinced the Ruffles are haunted. 10/10 &amp; 11/10 respectively https://t.co/fgORpmTN9C",10.0,10.0,Tassy,,Blenheim_spaniel,0.924127,Japanese_spaniel,0.0547900999999999,Chihuahua,0.00820404,464,1467,2015-12-17 02:30:09
677301033169788928,This is Juckson. He's totally on his way to a nascar race. 5/10 for Juckson https://t.co/IoLRvF0Kak,13.215172413793104,10.0,Juckson,,Japanese_spaniel,0.6611779999999999,Pekinese,0.150119,Chihuahua,0.11972,351,1091,2015-12-17 01:35:24
677269281705472000,This is the happiest pupper I've ever seen. 10/10 would trade lives with https://t.co/ep8ATEJwRb,10.0,10.0,the,pupper,Shetland_sheepdog,0.656616,collie,0.195405,German_shepherd,0.0131032,630,1762,2015-12-16 23:29:14
677187300187611136,Here we see a Byzantine Rigatoni. Very aerodynamic. No eyes. Actually not windy here they just look like that. 9/10 https://t.co/gzI0m6wXRo,9.0,10.0,,,English_setter,0.282396,Shih-Tzu,0.0841118999999999,Old_English_sheepdog,0.059538,798,2434,2015-12-16 18:03:28
676975532580409345,This is Cooper. He doesn't know how cheese works. Likes the way it feels on his face. Cheeky tongue slip. 11/10 https://t.co/j1zczS0lI5,11.0,10.0,Cooper,,malamute,0.363257,Siberian_husky,0.245862,Eskimo_dog,0.125547,936,2475,2015-12-16 04:01:59
676957860086095872,10/10 I'd follow this dog into battle no questions asked https://t.co/ngTNXYQF0L,10.0,10.0,,,Labrador_retriever,0.772423,beagle,0.0559016999999999,golden_retriever,0.0311519,715,1985,2015-12-16 02:51:45
676949632774234114,This is Tyrus. He's a Speckled Centennial Ticonderoga. Terrified of floating red ball. Nifty bandana. 8/10 v petable https://t.co/HqM3YhCaaa,8.0,10.0,Tyrus,,Welsh_springer_spaniel,0.206479,Saint_Bernard,0.139339,boxer,0.114606,346,1157,2015-12-16 02:19:04
676946864479084545,This pups goal was to get all four feet as close to each other as possible. Valiant effort 12/10 https://t.co/2mXALbgBTV,12.0,10.0,,,Pekinese,0.752707,golden_retriever,0.0556545999999999,Great_Pyrenees,0.0410178,322,1540,2015-12-16 02:08:04
676936541936185344,Here we see a rare pouched pupper. Ample storage space. Looks alert. Jumps at random. Kicked open that door. 8/10 https://t.co/mqvaxleHRz,8.0,10.0,,pupper,Chesapeake_Bay_retriever,0.5452859999999999,Norwegian_elkhound,0.081482,space_heater,0.0473911,4362,11363,2015-12-16 01:27:03
676821958043033607,Finally some constructive political change in this country. 11/10 https://t.co/mvQaETHVSb,11.0,10.0,,,Great_Pyrenees,0.8698040000000001,kuvasz,0.0798143,standard_poodle,0.0132629999999999,13547,20268,2015-12-15 17:51:44
676811746707918848,Say hello to Penny &amp; Gizmo. They are practicing their caroling. The ambition in the room is tangible. 9/10 for both https://t.co/aqBHjjh5VD,9.0,10.0,Penny,,Chihuahua,0.440916,Pomeranian,0.345806,cocker_spaniel,0.0603312,371,1282,2015-12-15 17:11:09
676617503762681856,I promise this wasn't meant to be a cuteness overload account but ermergerd look at this cozy pupper. 13/10 https://t.co/mpQl2rJjDh,13.0,10.0,,pupper,Chihuahua,0.841084,Pomeranian,0.12053,Pekinese,0.00660034,845,2568,2015-12-15 04:19:18
676603393314578432,This is Godzilla pupper. He had a ruff childhood &amp; now deflects that pain outward by terrorizing cities. Tragic 9/10 https://t.co/g1tLGkyaxr,9.0,10.0,Godzilla,pupper,whippet,0.8770209999999999,Great_Dane,0.0341819,boxer,0.028404,332,1018,2015-12-15 03:23:14
676588346097852417,This is Bubbles. He kinda resembles a fish. Always makes eye contact with u no matter what. Sneaky tongue slip. 5/10 https://t.co/Nrhvc5tLFT,13.215172413793104,10.0,Bubbles,,Boston_bull,0.976577,French_bulldog,0.0143237,Chihuahua,0.00230192,684,2036,2015-12-15 02:23:26
676496375194980353,Say hello to Griffin. He's upset because his costume for Halloween didn't arrive until today. 9/10 cheer up pup https://t.co/eoBCjSFajX,9.0,10.0,Griffin,,pug,0.985387,Norwegian_elkhound,0.0044169,French_bulldog,0.00389287,460,1343,2015-12-14 20:17:59
676470639084101634,Three generations of pupper. 11/10 for all https://t.co/tAmQYvzrau,11.0,10.0,,pupper,golden_retriever,0.7903859999999999,borzoi,0.0228851,dingo,0.0153434,4112,10369,2015-12-14 18:35:43
676440007570247681,Hope your Monday isn't too awful. Here's two baseball puppers. 11/10 for each https://t.co/dB0H9hdZai,11.0,10.0,,,Maltese_dog,0.579472,toy_poodle,0.133446,Shih-Tzu,0.0943966,581,1536,2015-12-14 16:34:00
676430933382295552,"Meet Duke. He's an Urban Parmesan. They know he's scared of the green rubber dog. ""Why u do dis?"" thinks Duke. 10/10 https://t.co/3bim9U5Idr",10.0,10.0,Duke,,golden_retriever,0.583875,cocker_spaniel,0.203671,Labrador_retriever,0.0361217,300,1235,2015-12-14 15:57:56
676237365392908289,Say hello to Winston. He has no respect for the system. Much rebellion. I think that's a palm tree... nice. 8/10 https://t.co/dOLQddhXLZ,8.0,10.0,Winston,,French_bulldog,0.961996,Chihuahua,0.021793,Boston_bull,0.00691629,244,1061,2015-12-14 03:08:46
676191832485810177,These two pups just met and have instantly bonded. Spectacular scene. Mesmerizing af. 10/10 and 7/10 for blue dog https://t.co/gwryaJO4tC,10.0,10.0,,,Chihuahua,0.376741,Italian_greyhound,0.173114,muzzle,0.0714851,904,2007,2015-12-14 00:07:50
676146341966438401,This is Bert. He likes flowers. 10/10 https://t.co/lmQRrNxaQu,10.0,10.0,Bert,,Irish_water_spaniel,0.388332,standard_poodle,0.284121,greenhouse,0.0348681,578,1722,2015-12-13 21:07:04
676101918813499392,Meet Striker. He's ready for Christmas. 11/10 https://t.co/B3xxSLjQSH,11.0,10.0,Striker,,Shih-Tzu,0.225848,Norfolk_terrier,0.186873,Irish_terrier,0.1069869999999999,1038,2541,2015-12-13 18:10:33
676089483918516224,"""Yes hello I'ma just snag this here toasted bagel real quick. carry on."" 9/10 https://t.co/Cuz0Osnekp",9.0,10.0,,,bull_mastiff,0.743808,boxer,0.106697,American_Staffordshire_terrier,0.0423353,384,1156,2015-12-13 17:21:08
675898130735476737,I'm sure you've all seen this pupper. Not prepared at all for the flying disc of terror. 10/10 https://t.co/G0pQiFGM7O,10.0,10.0,,pupper,Labrador_retriever,0.40743,malinois,0.0770367,pug,0.0745973,499,1410,2015-12-13 04:40:46
675891555769696257,This is Donny. He's summoning the demon monster Babadook. 6/10 Donny please no that won't be a good time for anyone https://t.co/kiW6Knb7Gp,13.215172413793104,10.0,Donny,,Italian_greyhound,0.305637,whippet,0.232057,Great_Dane,0.117806,753,1886,2015-12-13 04:14:39
675888385639251968,Breathtaking scene. A father taking care of his newborn pup. Tugs at the heartstrings. 10/10 restores my faith https://t.co/06oZdehGEa,10.0,10.0,,,West_Highland_white_terrier,0.672117,Old_English_sheepdog,0.146147,komondor,0.0231414,827,2078,2015-12-13 04:02:03
675870721063669760,&amp; this is Yoshi. Another world record contender 11/10 (what the hell is happening why are there so many contenders?) https://t.co/QG708dDNH6,11.0,10.0,,,golden_retriever,0.263892,Welsh_springer_spaniel,0.184193,beagle,0.182241,492,1433,2015-12-13 02:51:51
675853064436391936,Here we have an entire platoon of puppers. Total score: 88/80 would pet all at once https://t.co/y93p6FLvVw,13.215172413793104,10.49287356321839,,,Labrador_retriever,0.868367,golden_retriever,0.0433046,vizsla,0.0282072,1119,2379,2015-12-13 01:41:41
675845657354215424,"This is Pepper. She's not fully comfortable riding her imaginary bike yet. 10/10 don't worry pupper, it gets easier https://t.co/40dj4eTsXG",10.0,10.0,Pepper,pupper,pug,0.8839520000000001,Boston_bull,0.0110568,French_bulldog,0.00983981,766,2004,2015-12-13 01:12:15
675822767435051008,ðŸŽ¶ HELLO FROM THE OTHER SIIIIIIIIDE ðŸŽ¶ 10/10s https://t.co/GK2HJtkdQk,10.0,10.0,,,Pomeranian,0.46071,chow,0.202765,Pekinese,0.133266,469,1357,2015-12-12 23:41:18
675820929667219457,Here's a handful of sleepy puppers. All look unaware of their surroundings. Lousy guard dogs. Still cute tho 11/10s https://t.co/lyXX3v5j4s,11.0,10.0,,,basset,0.556373,beagle,0.201675,bloodhound,0.110848,203,937,2015-12-12 23:34:00
675798442703122432,This is Bernie. He just touched a boob for the first time. 10/10 https://t.co/whQKMygnK6,10.0,10.0,Bernie,,beagle,0.681218,basset,0.125121,boxer,0.0803982,3012,9129,2015-12-12 22:04:39
675781562965868544,Say hello to Buddah. He was Waldo for Halloween. 11/10 https://t.co/DVAqAnb624,11.0,10.0,Buddah,,Maltese_dog,0.921968,West_Highland_white_terrier,0.0178107,toy_poodle,0.0135554,415,1428,2015-12-12 20:57:34
675740360753160193,Here's a pupper licking in slow motion. 12/10 please enjoy https://t.co/AUJi8ujxw9,12.0,10.0,,pupper,golden_retriever,0.800495,kuvasz,0.0977564,Saluki,0.0684146,292,1036,2015-12-12 18:13:51
675710890956750848,This is Lenny. He was just told that he couldn't explore the fish tank. 12/10 smh all that work for nothing https://t.co/JWi6YrpiO1,12.0,10.0,Lenny,,standard_schnauzer,0.441427,miniature_schnauzer,0.248885,Sealyham_terrier,0.164967,710,1646,2015-12-12 16:16:45
675706639471788032,This is a Sizzlin Menorah spaniel from Brooklyn named Wylie. Lovable eyes. Chiller as hell. 10/10 and I'm out.. poof https://t.co/7E0AiJXPmI,10.0,10.0,a,,English_springer,0.9903,Welsh_springer_spaniel,0.00207991,cocker_spaniel,0.00201378,84,568,2015-12-12 15:59:51
675534494439489536,Seriously guys?! Only send in dogs. I only rate dogs. This is a baby black bear... 11/10 https://t.co/H7kpabTfLj,11.0,10.0,a,,chow,0.749368,schipperke,0.133738,Newfoundland,0.0499138,356,1629,2015-12-12 04:35:48
675531475945709568,This is Ellie AKA Queen Slayer of the Orbs. Very self-motivated. Great yard. Rad foliage. 10/10 would pet diligently https://t.co/c9jmg3Xtzn,10.0,10.0,Ellie,,Pembroke,0.918441,Cardigan,0.0273395,Siberian_husky,0.020221,325,1043,2015-12-12 04:23:49
675522403582218240,Meet Sammy. He's a Motorola Firefox. Hat under hoodie (must be a half-decent up and coming white rapper) 10/10 https://t.co/rO2zxf0OQ0,10.0,10.0,Sammy,,cocker_spaniel,0.299708,golden_retriever,0.263665,Irish_setter,0.0803233,248,914,2015-12-12 03:47:46
675517828909424640,12/10 stay woke https://t.co/XDiQw4Akiw,12.0,10.0,,,Scottish_deerhound,0.240591,groenendael,0.156916,flat-coated_retriever,0.0908993999999999,403,1120,2015-12-12 03:29:35
675497103322386432,Meet Reggie. He's going for the world record. Must concentrate. Focus up pup. 11/10 we all believe in you Reggie https://t.co/h3AWz4AzuC,11.0,10.0,Reggie,,vizsla,0.5195890000000001,miniature_pinscher,0.0647712,Rhodesian_ridgeback,0.0614913,1115,2759,2015-12-12 02:07:14
675432746517426176,Happy Friday. Here's some golden puppers. 12/10 for all https://t.co/wNkqAED6lG,12.0,10.0,,,Labrador_retriever,0.986548,golden_retriever,0.00886185,Chihuahua,0.000693528,495,1335,2015-12-11 21:51:30
675372240448454658,"The tail alone is 13/10. Great dog, better owner https://t.co/IyAXinfyju",13.0,10.0,,,Chihuahua,0.416385,West_Highland_white_terrier,0.102933,Samoyed,0.0872995,449,1497,2015-12-11 17:51:04
675349384339542016,Yea I lied. Here's more. All 13/10 https://t.co/ZQZf2U4xCP,13.0,10.0,,,borzoi,0.866367,Saluki,0.122079,Irish_wolfhound,0.00401972,1972,3458,2015-12-11 16:20:15
675334060156301312,Good morning here's a grass pupper. 12/10 https://t.co/2d68FmWGGs,12.0,10.0,,pupper,Pembroke,0.773135,Cardigan,0.11681,chow,0.0390362,1116,2431,2015-12-11 15:19:21
675149409102012420,holy shit 12/10 https://t.co/p6O8X93bTQ,12.0,10.0,,,chow,0.999876,Tibetan_mastiff,5.86749e-05,Tibetan_terrier,2.87785e-05,1477,3287,2015-12-11 03:05:37
675147105808306176,When you're presenting a group project and the 4th guy tells the teacher that he did all the work. 10/10 https://t.co/f50mbB4UWS,10.0,10.0,,,golden_retriever,0.949215,Labrador_retriever,0.0167654,flat-coated_retriever,0.0106372999999999,196,827,2015-12-11 02:56:28
675145476954566656,What an honor. 3 dogs here. Blond one is clearly a gymnast. Other two just confused. Very nifty pups. 9/10 for all https://t.co/YDgstgIDGs,9.0,10.0,,,Labrador_retriever,0.458746,Great_Dane,0.235504,Staffordshire_bullterrier,0.116864,769,1876,2015-12-11 02:49:59
675111688094527488,Say hello to Oliver. He thought what was inside the pillow should be outside the pillow. Blurry since birth. 8/10 https://t.co/lFU9W31Fg9,8.0,10.0,Oliver,,Labrador_retriever,0.631501,Brittany_spaniel,0.101927,Chesapeake_Bay_retriever,0.0626498,210,852,2015-12-11 00:35:44
