tweet_id,text,rating_numerator,rating_denominator,name,type,p1,p1_conf,p2,p2_conf,p3,p3_conf,retweet_count,favorite_count,created_at
813800681631023104,This is Sky. She's learning how to roll her R's. 12/10 cultured af https://t.co/OuaVvVkwJ1,12.0,10.0,Sky,,malamute,0.501159,Siberian_husky,0.228792,Eskimo_dog,0.200388,1623,7700,2016-12-27 17:36:16
813217897535406080,Here is Atlas. He went all out this year. 13/10 downright magical af https://t.co/DVYIZOnO81,13.0,10.0,Atlas,,Samoyed,0.905972,Pomeranian,0.0480383,West_Highland_white_terrier,0.0356671,6756,17275,2016-12-26 03:00:30
813202720496779264,Here's a doggo who has concluded that Christmas is entirely too bright. Requests you tone it down a notch. 11/10 https://t.co/cD967DjnIn,11.0,10.0,,doggo,cocker_spaniel,0.701852,golden_retriever,0.120345,Labrador_retriever,0.0363202,1677,8573,2016-12-26 02:00:11
813187593374461952,We only rate dogs. Please don't send in other things like this very good Christmas tree. Thank you... 13/10 https://t.co/rvSANEsQZJ,13.0,10.0,,,golden_retriever,0.888181,Labrador_retriever,0.0423119,Saluki,0.00970173,3980,18368,2016-12-26 01:00:05
813142292504645637,Everybody stop what you're doing and look at this dog with her tiny Santa hat. 13/10 https://t.co/KK4XQK9SPi,13.0,10.0,,,beagle,0.848735,Ibizan_hound,0.0446024999999999,Italian_greyhound,0.0186108,2210,7877,2016-12-25 22:00:04
813127251579564032,Here's an anonymous doggo that appears to be very done with Christmas. 11/10 cheer up pup https://t.co/BzITyGw3JA,11.0,10.0,,doggo,Norwegian_elkhound,0.4324159999999999,whippet,0.374223,Siberian_husky,0.0324625999999999,2881,10980,2016-12-25 21:00:18
813096984823349248,This is Rocky. He got triple-doggo-dared. Stuck af. 11/10 someone help him https://t.co/soNL00XWVu,11.0,10.0,Rocky,doggo,Great_Dane,0.128056,Boston_bull,0.117003,kelpie,0.0869643,3330,9775,2016-12-25 19:00:02
813081950185472002,This is Baron. He's officially festive as h*ck. Thinks it's just a fancy scarf. 11/10 would pat head approvingly https://t.co/PjulYEXTvg,11.0,10.0,Baron,,Doberman,0.909951,kelpie,0.0426494,miniature_pinscher,0.0230041,2564,9211,2016-12-25 18:00:17
813066809284972545,This is Tyr. He is disgusted by holiday traffic. Just trying to get to Christmas brunch on time. 12/10 hurry up pup https://t.co/syuTXARdtN,12.0,10.0,Tyr,,toy_terrier,0.7764,Pembroke,0.115034,basenji,0.048873,1805,7383,2016-12-25 17:00:08
813051746834595840,This is Bauer. He had nothing to do with the cookies that disappeared. 13/10 very good boy https://t.co/AIMF8ouzvl,13.0,10.0,Bauer,,golden_retriever,0.914804,Labrador_retriever,0.08355,kuvasz,0.000453224,6740,19470,2016-12-25 16:00:16
812781120811126785,This is Swagger. He's the Cleveland Browns ambassador. Hype as h*ck after that first win today. 10/10 https://t.co/lXFM1l22bG,10.0,10.0,Swagger,,bull_mastiff,0.989316,boxer,0.00704296,French_bulldog,0.00173961,1766,7003,2016-12-24 22:04:54
812709060537683968,This is Brandi and Harley. They are practicing their caroling for later. Both 12/10 festive af https://t.co/AbBDuGZUpp,12.0,10.0,Brandi,,Irish_setter,0.326873,golden_retriever,0.18261,Leonberg,0.156912,1337,6129,2016-12-24 17:18:34
812372279581671427,This is Moe. He's a fetty woof. Got a cardboard cutout of himself for Christmas. 13/10 inspirational af https://t.co/gCnAeL2mvT,13.0,10.0,Moe,,golden_retriever,0.7848729999999999,cocker_spaniel,0.0877881,Labrador_retriever,0.0832747,3373,12644,2016-12-23 19:00:19
811985624773361665,Say hello to Ted. He accidentally opened the front facing camera. 11/10 h*ckin unpupared https://t.co/sIB5C6FDop,11.0,10.0,Ted,,Staffordshire_bullterrier,0.6105729999999999,French_bulldog,0.159935,doormat,0.0586721,1297,6752,2016-12-22 17:23:53
811744202451197953,This is Halo. She likes watermelon. 13/10 https://t.co/TZkiQZqwA6,13.0,10.0,Halo,,Pekinese,0.386082,Labrador_retriever,0.202862,golden_retriever,0.170487,1451,7009,2016-12-22 01:24:33
811627233043480576,This is Augie. He's a savage. Doesn't give a h*ck about your garden. Still 10/10 would forgive then pet https://t.co/IU8S0n4oxn,10.0,10.0,Augie,,beagle,0.39628,Pembroke,0.0495619,wire-haired_fox_terrier,0.0463491999999999,2806,11800,2016-12-21 17:39:46
811386762094317568,This is Craig. That's actually a normal sized fence he's stuck on. H*ckin massive pupper. 11/10 someone help him https://t.co/aAUXzoxaBy,11.0,10.0,Craig,pupper,Pembroke,0.804177,Cardigan,0.18989,beagle,0.00196475,5888,19377,2016-12-21 01:44:13
810984652412424192,"Meet Sam. She smiles 24/7 &amp; secretly aspires to be a reindeer. 
Keep Sam smiling by clicking and sharing this link:
https://t.co/98tB8y7y7t https://t.co/LouL5vdvxx",13.215172413793104,10.49287356321839,Sam,,golden_retriever,0.8713420000000001,Tibetan_mastiff,0.0367077,Labrador_retriever,0.0258232,1307,4927,2016-12-19 23:06:23
810896069567610880,"This is Hunter. He just found out he needs braces. Requesting an orthodogtist stat. 11/10 you're fine Hunter, everything's fine https://t.co/zW1o0W4AYV",11.0,10.0,Hunter,,flat-coated_retriever,0.8208040000000001,Labrador_retriever,0.0823182,curly-coated_retriever,0.0674605,1611,8327,2016-12-19 17:14:23
810657578271330305,This is Pavlov. His floatation device has failed him. He's quite pupset about it. 11/10 would rescue https://t.co/MXd0AGDsRJ,11.0,10.0,Pavlov,,malamute,0.753521,Siberian_husky,0.166151,Eskimo_dog,0.0698108,2423,10167,2016-12-19 01:26:42
810284430598270976,This is Phil. He's a father. A very good father too. 13/10 everybody loves Phil https://t.co/9p6ECXJMMu,13.0,10.0,Phil,,malamute,0.620768,Eskimo_dog,0.158395,Tibetan_mastiff,0.0289617,10358,32571,2016-12-18 00:43:57
810254108431155201,"This is Gus. He likes to be close to you, which is good because you want to be close to Gus. 12/10 would boop then pet https://t.co/DrsrQkEfnb",12.0,10.0,Gus,,Staffordshire_bullterrier,0.292556,American_Staffordshire_terrier,0.261233,Border_terrier,0.0623754,3108,13582,2016-12-17 22:43:27
809920764300447744,"Please only send in dogs. We only rate dogs, not seemingly heartbroken ewoks. Thank you... still 10/10 would console https://t.co/HIraYS1Bzo",10.0,10.0,,,Norwich_terrier,0.397163,toy_poodle,0.27454,miniature_poodle,0.134667,3621,14381,2016-12-17 00:38:52
809448704142938112,"I call this one ""A Blep by the Sea"" 12/10 https://t.co/EMdnCugNbo",12.0,10.0,,,Greater_Swiss_Mountain_dog,0.375415,Cardigan,0.134317,English_springer,0.0736971,1347,6460,2016-12-15 17:23:04
809220051211603969,This is Kyro. He's a Stratocumulus Flop. Tongue ejects at random. Serious h*ckin condition. Still 12/10 would pet passionately https://t.co/wHu15q2Q6p,12.0,10.0,Kyro,,Pomeranian,0.8195110000000001,Samoyed,0.141241,Pembroke,0.0134552,5158,18427,2016-12-15 02:14:29
809084759137812480,"This is Wallace. You said you brushed your teeth but he checked your toothbrush and it was bone dry. 11/10 not pupset, just disappointed https://t.co/nadm8yWZ4h",11.0,10.0,Wallace,,vizsla,0.911412,bloodhound,0.0171339,Labrador_retriever,0.011761,3236,12231,2016-12-14 17:16:53
808838249661788160,This is Ito. He'll be your uber driver tonight. Currently adjusting the mirrors. 13/10 incredibly h*ckin responsible https://t.co/Zrrcw29o13,13.0,10.0,Ito,,Rottweiler,0.36953,miniature_pinscher,0.194867,kelpie,0.160104,2816,9394,2016-12-14 00:57:20
808501579447930884,This is Koda. He dug a hole and then sat in it because why not. Unamused by the bath that followed. 12/10 https://t.co/SQhyqrr8px,12.0,10.0,Koda,,Airedale,0.454239,cocker_spaniel,0.219323,Irish_terrier,0.093193,2424,10491,2016-12-13 02:39:32
808106460588765185,Here we have Burke (pupper) and Dexter (doggo). Pupper wants to be exactly like doggo. Both 12/10 would pet at same time https://t.co/ANBpEYHaho,12.0,10.0,,doggo,golden_retriever,0.426183,Labrador_retriever,0.257447,Great_Pyrenees,0.1264819999999999,2035,8190,2016-12-12 00:29:28
808001312164028416,This is Cooper. He likes to stick his tongue out at you and then laugh about it. 12/10 quite the jokester https://t.co/O9iGgvfuzl,12.0,10.0,Cooper,,Labrador_retriever,0.730959,Staffordshire_bullterrier,0.130726,American_Staffordshire_terrier,0.0288526,3255,11589,2016-12-11 17:31:39
807621403335917568,This is Ollie Vue. He was a 3 legged pupper on a mission to overcome everything. This is very hard to write. 14/10 we will miss you Ollie https://t.co/qTRY2qX9y4,14.0,10.0,Ollie,pupper,golden_retriever,0.873233,cocker_spaniel,0.0336933,chow,0.0204084,3337,13536,2016-12-10 16:22:02
807106840509214720,This is Stephan. He just wants to help. 13/10 such a good boy https://t.co/DkBYaCAg2d,13.0,10.0,Stephan,,Chihuahua,0.50537,Pomeranian,0.1203579999999999,toy_terrier,0.0770081,50799,109249,2016-12-09 06:17:20
807010152071229440,This is Lennon. He's a Boopershnoop Pupperdoop. Quite rare. Exceptionally pettable. 12/10 would definitely boop that shnoop https://t.co/fhgP6vSfhX,12.0,10.0,Lennon,,golden_retriever,0.610807,Irish_setter,0.213642,Welsh_springer_spaniel,0.0318866,3563,12136,2016-12-08 23:53:08
806542213899489280,This is Waffles. He's concerned that the dandruff shampoo he just bought is faulty. 11/10 tragic af https://t.co/BCB87qUU0h,11.0,10.0,Waffles,,vizsla,0.938617,Brittany_spaniel,0.0367389,Chesapeake_Bay_retriever,0.00397149,2188,9510,2016-12-07 16:53:43
806219024703037440,We only rate dogs. Please stop sending in non-canines like this Freudian Poof Lion. This is incredibly frustrating... 11/10 https://t.co/IZidSrBvhi,11.0,10.0,incredibly,,chow,0.835102,Pomeranian,0.0407829,Eskimo_dog,0.0212745,1107,5983,2016-12-06 19:29:28
805932879469572096,This is Major. He put on a tie for his first real walk. Only a little crooked. Can also drool upwards. H*ckin talented. 12/10 https://t.co/Zcwr8LgoO8,12.0,10.0,Major,,Norwegian_elkhound,0.657967,keeshond,0.319136,Leonberg,0.00794674,1775,7688,2016-12-06 00:32:26
805826884734976000,This is Duke. He is not a fan of the pupporazzi. 12/10 https://t.co/SgpBVYIL18,12.0,10.0,Duke,,Siberian_husky,0.248926,American_Staffordshire_terrier,0.0983133,Eskimo_dog,0.0801885,1691,6107,2016-12-05 17:31:15
805520635690676224,This is Zeke the Wonder Dog. He never let that poor man keep his frisbees. One of the Spartans all time greatest receivers. 13/10 RIP Zeke https://t.co/zacX7S6GyJ,13.0,10.0,Zeke,,malinois,0.643147,German_shepherd,0.186642,Border_terrier,0.109345,1528,5359,2016-12-04 21:14:20
805207613751304193,This is Shooter. He's doing quite the snowy zoom. 12/10 https://t.co/lHy4Xbyhd9,12.0,10.0,Shooter,,Pembroke,0.244705,Rhodesian_ridgeback,0.1804609999999999,Cardigan,0.0946636999999999,1598,7300,2016-12-04 00:30:29
804738756058218496,This is Django. He accidentally opened the front facing camera. Did him quite the frighten. 12/10 https://t.co/kQVQoOW9NZ,12.0,10.0,Django,,Tibetan_mastiff,0.91579,German_shepherd,0.0624797,Leonberg,0.00829749,3543,12642,2016-12-02 17:27:25
803773340896923648,This is Diogi. He fell in the pool as soon as he was brought home. Clumsy puppo. 12/10 would pet until dry https://t.co/ZxeRjMKaWt,12.0,10.0,Diogi,puppo,miniature_pinscher,0.817066,redbone,0.0597065,Irish_terrier,0.0341952,2548,9332,2016-11-30 01:31:12
803638050916102144,Pupper hath acquire enemy. 13/10 https://t.co/ns9qoElfsX,13.0,10.0,,pupper,Labrador_retriever,0.372776,golden_retriever,0.3436659999999999,Great_Pyrenees,0.0672423,3835,10164,2016-11-29 16:33:36
803276597545603072,This is Winston. His selfie game is legendary. Will steal your girl with a single snap. 11/10 handsome as h*ck https://t.co/jxQhxoPsgL,11.0,10.0,Winston,,Pembroke,0.457086,chow,0.307801,golden_retriever,0.0499881999999999,2266,9321,2016-11-28 16:37:19
802952499103731712,This is Marley. She's having a ruff day. Pretty pupset. 12/10 would assist https://t.co/yLm7hQ6UXh,12.0,10.0,Marley,,chow,0.944032,golden_retriever,0.0172398,Pomeranian,0.0120848,1841,8395,2016-11-27 19:09:28
802572683846291456,This is Winnie. She's h*ckin ferocious. Dandelion doesn't even see her coming. 12/10 would pet with caution https://t.co/EFfLCP7oQv,12.0,10.0,Winnie,,golden_retriever,0.610171,Labrador_retriever,0.173252,cocker_spaniel,0.1632569999999999,2319,8322,2016-11-26 18:00:13
802265048156610565,"Like doggo, like pupper version 2. Both 11/10 https://t.co/9IxWAXFqze",11.0,10.0,,doggo,Labrador_retriever,0.8971620000000001,beagle,0.0168947999999999,Rhodesian_ridgeback,0.0120606,1274,6455,2016-11-25 21:37:47
802239329049477120,This is Loki. He'll do your taxes for you. Can also make room in your budget for all the things you bought today. 12/10 what a puppo https://t.co/5oWrHCWg87,12.0,10.0,Loki,puppo,Eskimo_dog,0.482498,Siberian_husky,0.3357739999999999,malamute,0.134589,2414,8455,2016-11-25 19:55:35
801958328846974976,This is Ronnie. He hopes you're having a great day. Nifty tongue slip. 12/10 would pat head approvingly https://t.co/4fY2bsAm65,12.0,10.0,Ronnie,,Staffordshire_bullterrier,0.327887,American_Staffordshire_terrier,0.271916,Labrador_retriever,0.247619,1567,7204,2016-11-25 01:18:59
801538201127157760,This is Wallace. He'll be your chau-fur this evening. 12/10 eyes on the road Wallace https://t.co/p1RD39XjUe,12.0,10.0,Wallace,,Pembroke,0.550506,Cardigan,0.306612,Shetland_sheepdog,0.0542299999999999,1927,7631,2016-11-23 21:29:33
801167903437357056,This is Milo. I would do terrible things for Milo. 13/10 https://t.co/R6wJyC2Tey,13.0,10.0,Milo,,cocker_spaniel,0.74022,Dandie_Dinmont,0.0616044999999999,English_setter,0.0413314,5426,22583,2016-11-22 20:58:07
801115127852503040,This is Bones. He's being haunted by another doggo of roughly the same size. 12/10 deep breaths pupper everything's fine https://t.co/55Dqe0SJNj,12.0,10.0,Bones,doggo,dalmatian,0.823356,English_setter,0.0946018999999999,bluetick,0.0219534,1964,7497,2016-11-22 17:28:25
800751577355128832,Say hello to Mauve and Murphy. They're rather h*ckin filthy. Preferred nap over bath. Both 12/10 https://t.co/4UwCTW3lXG,12.0,10.0,Mauve,,cocker_spaniel,0.771984,miniature_poodle,0.0766528,toy_poodle,0.0396183,2593,9871,2016-11-21 17:23:47
800513324630806528,This is Chef. Chef loves everyone and wants everyone to love each other. 11/10 https://t.co/ILHGs0e6Dm,11.0,10.0,Chef,,Pembroke,0.8289040000000001,Cardigan,0.167373,Chihuahua,0.0007659339999999,2779,12168,2016-11-21 01:37:04
800388270626521089,This is Doc. He takes time out of every day to worship our plant overlords. 12/10 quite the floofer https://t.co/azMneS6Ly5,12.0,10.0,Doc,floofer,golden_retriever,0.35986,Pembroke,0.194207,collie,0.154603,2597,10357,2016-11-20 17:20:08
800141422401830912,This is Peaches. She's the ultimate selfie sidekick. Super sneaky tongue slip appreciated. 13/10 https://t.co/pbKOesr8Tg,13.0,10.0,Peaches,,golden_retriever,0.938048,kuvasz,0.0251195,Labrador_retriever,0.0229773,2359,14207,2016-11-20 00:59:15
799757965289017345,This is Sobe. She's a h*ckin happy doggo. Only one leg tho. Must have good balance. 13/10 would smile back https://t.co/OiH8PaOxB1,13.0,10.0,Sobe,doggo,Border_collie,0.442534,collie,0.288684,Shetland_sheepdog,0.196399,1981,7770,2016-11-18 23:35:32
799422933579902976,This is Longfellow (prolly sophisticated). He's a North Appalachian Oatzenjammer. Concerned about wrinkled feets. 12/10 would hug softly https://t.co/bpLuQuxzHZ,12.0,10.0,Longfellow,,miniature_pinscher,0.58363,redbone,0.276095,toy_terrier,0.0185500999999999,1768,7476,2016-11-18 01:24:14
799297110730567681,This is Jeffrey. He's quite the jokester. Takes it too far sometimes. Still 11/10 would pet https://t.co/YDtZcAiMAf,11.0,10.0,Jeffrey,,malamute,0.985028,Siberian_husky,0.00583442,Eskimo_dog,0.00544281,2514,9181,2016-11-17 17:04:16
799063482566066176,This is Mister. He only wears the most fashionable af headwear. 11/10 h*ckin stylish https://t.co/BXJFKOVnJm,11.0,10.0,Mister,,Norfolk_terrier,0.334436,Norwich_terrier,0.231573,Australian_terrier,0.214203,2311,7520,2016-11-17 01:35:54
798933969379225600,This is Iroh. He's in a predicament. 12/10 someone help him https://t.co/KJAKO2kXsL,12.0,10.0,Iroh,,Siberian_husky,0.703224,Eskimo_dog,0.229351,malamute,0.0443508,4098,12139,2016-11-16 17:01:16
798925684722855936,This is Shadow. He's a firm believer that they're all good dogs. H*ckin passionate about it too. 11/10 I stand with Shadow https://t.co/8yvpacwBcu,11.0,10.0,Shadow,,West_Highland_white_terrier,0.539463,cairn,0.184897,Norfolk_terrier,0.163024,1336,6970,2016-11-16 16:28:21
798209839306514432,This is Cooper. His bow tie was too heavy for the front so he moved it to the side. Balanced af now. 13/10 https://t.co/jG1PAFkB81,13.0,10.0,Cooper,,Pekinese,0.524583,Shih-Tzu,0.102931,Pomeranian,0.0978931,2395,9700,2016-11-14 17:03:50
797971864723324932,Here's a helicopter pupper. He takes off at random. H*ckin hard to control. 12/10 rare af https://t.co/GRWPgNKt2z,12.0,10.0,,pupper,American_Staffordshire_terrier,0.489845,Chihuahua,0.30576,Staffordshire_bullterrier,0.0727991,2854,10720,2016-11-14 01:18:12
797545162159308800,This is Cassie. She steals things. Guilt increases slightly each time. 12/10 would forgive almost immediately https://t.co/Ia19irLwyB,12.0,10.0,Cassie,,Pembroke,0.954089,Cardigan,0.0336439,papillon,0.00973566,4558,13515,2016-11-12 21:02:38
797236660651966464,This is Pancake. She loves Batman and winks like a h*ckin champ. 12/10 real crowd pleaser https://t.co/6kqsAjJNhi,12.0,10.0,Pancake,,collie,0.767005,Border_collie,0.100844,kelpie,0.0483681,6065,18519,2016-11-12 00:36:46
796865951799083009,This is Tyr. He's just checking on you. Nifty af tongue slip. 12/10 would absolutely pet https://t.co/Jgnuiyvq06,12.0,10.0,Tyr,,Cardigan,0.8391290000000001,Boston_bull,0.0806985,Pembroke,0.034505,1815,7144,2016-11-11 00:03:42
796759840936919040,Say hello to Romeo. He was just told that it's too cold for the pool. H*ckin nonsense. 11/10 would help fill up https://t.co/6hx7ur6sNI,11.0,10.0,Romeo,,American_Staffordshire_terrier,0.463996,Staffordshire_bullterrier,0.155566,Weimaraner,0.137587,2785,10943,2016-11-10 17:02:03
796387464403357696,This is Snicku. He's having trouble reading because he's a dog. Glasses only helped a little. Nap preferred. 12/10 would snug well https://t.co/cVLUasbKA5,12.0,10.0,Snicku,,Pekinese,0.461164,Pomeranian,0.28865,Siamese_cat,0.052423,3825,10206,2016-11-09 16:22:22
796149749086875649,This is Ruby. She just turned on the news. Officially terrified. 11/10 deep breaths Ruby https://t.co/y5KarNXWXt,11.0,10.0,Ruby,,golden_retriever,0.600276,Labrador_retriever,0.140798,seat_belt,0.0873548,13147,29852,2016-11-09 00:37:46
796116448414461957,I didn't believe it at first but now I can see that voter fraud is a serious h*ckin issue. 11/10 https://t.co/7i0bDMbrVN,11.0,10.0,,,Cardigan,0.700182,Pembroke,0.260738,papillon,0.0171099,2213,8429,2016-11-08 22:25:27
796080075804475393,This is Yogi. He's 98% floof. Snuggable af. 12/10 https://t.co/opoXKxmfFm,12.0,10.0,Yogi,,chow,0.973846,Tibetan_mastiff,0.0141098999999999,gibbon,0.00235832,2138,7814,2016-11-08 20:00:55
796031486298386433,This is Daisy. She's here to make your day better. 13/10 mission h*ckin successful https://t.co/PbgvuD0qIL,13.0,10.0,Daisy,,golden_retriever,0.893775,Labrador_retriever,0.0701398,doormat,0.00841853,3443,10014,2016-11-08 16:47:50
795464331001561088,Elder doggo does a splash. Both 13/10 incredible stuff https://t.co/gBUDjdEcqz,13.0,10.0,,doggo,golden_retriever,0.193082,Chesapeake_Bay_retriever,0.157927,soft-coated_wheaten_terrier,0.1246839999999999,21611,45832,2016-11-07 03:14:10
795400264262053889,This is Brody. He's trying to make the same face as the football. 12/10 https://t.co/2H4MfOGlpQ,12.0,10.0,Brody,,golden_retriever,0.925494,Labrador_retriever,0.0592408,tennis_ball,0.00449534,2646,9316,2016-11-06 22:59:35
794332329137291264,This is Nimbus (like the cloud). He just bought this fancy af duck raincoat. Only protects one ear tho. 12/10 so h*ckin floofy https://t.co/SIQbb8c3AU,12.0,10.0,Nimbus,,Samoyed,0.988307,malamute,0.00490635,Great_Pyrenees,0.00290129,2499,8920,2016-11-04 00:15:59
793962221541933056,This is Maximus. His face is stuck like that. Tragic really. Great tongue tho. 12/10 would pet firmly https://t.co/xIfrsMNLBR,12.0,10.0,Maximus,,Labrador_retriever,0.8616510000000001,golden_retriever,0.0444618,Staffordshire_bullterrier,0.0164967,4509,15555,2016-11-02 23:45:19
793845145112371200,This is Clark. He was just caught wearing pants. 13/10 game-changing af https://t.co/2Xo19aPrG5,13.0,10.0,Clark,,Old_English_sheepdog,0.7652770000000001,Bedlington_terrier,0.1127529999999999,Kerry_blue_terrier,0.0476616999999999,1719,8534,2016-11-02 16:00:06
793601777308463104,This is Dobby. I can't stop looking at her feet. 12/10 would absolutely snug https://t.co/LhzPWv6rTv,12.0,10.0,Dobby,,miniature_pinscher,0.538981,Chihuahua,0.21783,toy_terrier,0.0891487,1501,7384,2016-11-01 23:53:02
793500921481273345,This is Fiona. She's an extremely mediocre copilot. Very distracting. Wink makes up for all the missed turns. 12/10 https://t.co/aF5MmpvPqN,12.0,10.0,Fiona,,golden_retriever,0.3261219999999999,Labrador_retriever,0.219904,Chesapeake_Bay_retriever,0.163366,2195,9875,2016-11-01 17:12:16
793286476301799424,This is Moreton. He's the Good Boy Who Lived. 13/10 magical as h*ck https://t.co/rLHGx3VAF3,13.0,10.0,Moreton,,Afghan_hound,0.2746369999999999,borzoi,0.142204,doormat,0.109677,8457,22781,2016-11-01 03:00:09
793271401113350145,Meet Dave. It's his favorite day of the year. He gets to fulfill his dream of being a dinosaur. 12/10 inspirational af https://t.co/MgQSdfZGPN,12.0,10.0,Dave,,Siberian_husky,0.2316949999999999,Eskimo_dog,0.206749,Pembroke,0.0701195,2224,8046,2016-11-01 02:00:14
793256262322548741,Oh h*ck look at this spookling right here. Fright level off the charts. 12/10 sufficiently spooked https://t.co/BNy9IIJMb0,12.0,10.0,,,basset,0.2076219999999999,Walker_hound,0.0605741999999999,beagle,0.0412205,7666,18514,2016-11-01 01:00:05
793241302385262592,This is Tucker. He's out here bustin h*ckin ghosts. 13/10 dedicated af https://t.co/Ap477GhwXt,13.0,10.0,Tucker,,golden_retriever,0.559308,Labrador_retriever,0.3902219999999999,cocker_spaniel,0.0363157,3030,9737,2016-11-01 00:00:38
793226087023144960,"This is Juno. She spooked me up real good, but only to get my attention. Above average handwriting for a dog I think. 11/10 https://t.co/hFxxBCWlwj",11.0,10.0,Juno,,wire-haired_fox_terrier,0.456047,Lakeland_terrier,0.273428,English_springer,0.0836433,2681,9086,2016-10-31 23:00:11
793195938047070209,Say hello to Lily. She's pupset that her costume doesn't fit as well as last year. 12/10 poor puppo https://t.co/YSi6K1firY,12.0,10.0,Lily,puppo,Labrador_retriever,0.654762,golden_retriever,0.0741,Chihuahua,0.0423393,5205,14142,2016-10-31 21:00:23
793180763617361921,This is Newt. He's a strawberry. 11/10 https://t.co/2VhmlwxA1Q,11.0,10.0,Newt,,Lakeland_terrier,0.266824,Irish_terrier,0.218783,Airedale,0.13296,1837,6410,2016-10-31 20:00:05
793165685325201412,This is Benji. He's Air Bud. It's a low effort costume but he pulls it off rather h*ckin well. 12/10 would happily get dunked on https://t.co/IbzT7DJvBo,12.0,10.0,Benji,,golden_retriever,0.946224,Labrador_retriever,0.0364766,doormat,0.00235285,2595,8692,2016-10-31 19:00:10
793150605191548928,This is Nida. She's a free elf. Waited so long for this day. 11/10 https://t.co/3lE8Izgmkf,11.0,10.0,Nida,,Italian_greyhound,0.193869,bluetick,0.16038,standard_poodle,0.1259819999999999,1569,5698,2016-10-31 18:00:14
793120401413079041,"This is Robin. She's desperately trying to do me a frighten, but her tongue drastically decreases her spook value. Still 11/10 great effort https://t.co/sxMrsOZ8zb",11.0,10.0,Robin,,Labrador_retriever,0.7249439999999999,golden_retriever,0.169744,kuvasz,0.0355023,3618,11754,2016-10-31 16:00:13
792773781206999040,This is Monster. Not an actual monster tho. He's showing you his tongue. Very impressive Monster. 12/10 would snug https://t.co/RhaPExuxJL,12.0,10.0,Monster,,Yorkshire_terrier,0.912804,silky_terrier,0.0678225,Australian_terrier,0.00445069,1552,6831,2016-10-30 17:02:53
792394556390137856,Meet BeBe. She rocks the messy bun of your dreams. H*ckin flawless. 12/10 would watch her tutorial https://t.co/of0pFNBIl8,12.0,10.0,BeBe,,cocker_spaniel,0.746387,Irish_setter,0.0916151,miniature_poodle,0.0610781999999999,3958,12420,2016-10-29 15:55:58
791672322847637504,When she says you're a good boy and you know you're a good boy because you're a good boy. 13/10 https://t.co/O5IUmRHRIh,13.0,10.0,,,golden_retriever,0.705092,Labrador_retriever,0.219721,kuvasz,0.015965,2870,10860,2016-10-27 16:06:04
791406955684368384,Say hello to Levi. He's a Madagascan Butterbop. One of the more docile Butterbops I've seen. 12/10 would give all the pets https://t.co/Zcw9Sccctc,12.0,10.0,Levi,,Pembroke,0.972629,Cardigan,0.0270259,basenji,0.000152502,3800,12191,2016-10-26 22:31:36
791312159183634433,This is Mabel. She's super h*ckin smol. Portable af. Comes with the smol shoe. 12/10 would keep in frocket https://t.co/GGJvxYt3xK,12.0,10.0,Mabel,,miniature_pinscher,0.892925,toy_terrier,0.0955238,Doberman,0.00354426,2328,8116,2016-10-26 16:14:55
790987426131050500,This is Misty. She has a cowboy hat on her nose. 12/10 https://t.co/Eno0mypHIr,12.0,10.0,Misty,,cocker_spaniel,0.349195,flat-coated_retriever,0.309535,Newfoundland,0.104768,1958,9082,2016-10-25 18:44:32
790698755171364864,This is Mosby. He appears to be rather h*ckin snuggable af. 12/10 keep it up Mosby https://t.co/IiiBq460I7,12.0,10.0,Mosby,,Bernese_mountain_dog,0.996541,EntleBucher,0.00105698,Appenzeller,0.000997907,1778,7619,2016-10-24 23:37:28
790337589677002753,Meet Maggie. She can hear your cells divide. 12/10 can also probably fly https://t.co/ovE2hqXryV,12.0,10.0,Maggie,,Pembroke,0.658808,Cardigan,0.153096,toy_terrier,0.102299,1743,7242,2016-10-23 23:42:19
790277117346975746,This is Bruce. He never backs down from a challenge. 11/10 you got this Bruce https://t.co/aI7umZHIq7,11.0,10.0,Bruce,,Labrador_retriever,0.427742,Great_Dane,0.190503,curly-coated_retriever,0.146427,2916,11594,2016-10-23 19:42:02
